titulo,descripcion,¿resaltar?,url
GASTOS-2025,Seguimiento de los gastos familiares para el 2025 ,sí, https://docs.google.com/spreadsheets/d/1gXWv-FXbcCOdzZCkZoS1dftrBQt8Qqgobv8-SuVJux0/edit?gid=1567025871#gid=1567025871
Documento-01,Descripción del documento uno,no, https://chat.openai.com/
Documento-02,Descripción del documento dos,no,https://drive.google.com/drive/folders/1bYQxmovRG6IZPTfyLjYMpoUaGBRy3d2e
Documento-03,Descripción del documento tres - RESALTADO,sí,https://chat.openai.com/
Documento-04,Descripción del documento cuatro,no,https://chat.openai.com/
Documento-05,Descripción del documento cinco - RESALTADO,sí,https://chat.openai.com/
Documento-06,Descripción del documento seis,no,https://chat.openai.com/
